{
  "schema_version": "1.0.0",
  "handoff_id": "HO-CASINO-RULE-0001-001",
  "task_id": "CASINO-RULE-0001",
  "from_agent_id": "A-10",
  "to_agent_id": "A-50",
  "created_at": "2026-08-28T01:05:00Z",
  "summary": "유럽식 단일 제로 룰렛의 베팅 유효성, 당첨 판정, 지급 배수와 예외 규칙 초안을 제출한다.",
  "artifact_refs": ["ART-ROULETTE-RULES-0001"],
  "assumptions": ["환전과 현금 인출이 없는 소셜 게임이다."],
  "verification_evidence": [
    {
      "check": "스키마와 용어 일관성 검사",
      "result": "PASS",
      "evidence_uri": "tests://casino-rule-0001/schema"
    },
    {
      "check": "전체 지급 조합 전수 검증",
      "result": "NOT_RUN",
      "evidence_uri": "tests://casino-rule-0001/payout-enumeration"
    }
  ],
  "known_risks": [
    {
      "severity": "HIGH",
      "description": "지급표는 QA 전수 검증 전 승인할 수 없다.",
      "owner_agent_id": "A-50"
    }
  ],
  "next_action": "지급 조합을 전수 열거하고 결정론적 리플레이 테스트를 실행한다.",
  "readiness": "READY_FOR_QA",
  "acknowledgement_required": true
}

